esp,10,2,¿De qué color es?,Debe ser aceptado o reconocido por todos como un gran logro.
esp,10,3,¿Cómo está?,"Debe ser sobresaliente, ejemplar."
esp,10,4,¿Cómo es?,"Debe ser real, verdadero, en vez de imaginario o ilusorio."
esp,10,5,¿En dónde está?,"Debes realizarlo en esta vida, en este planeta, en este plano de existencia."
esp,10,6,"¿Hay nubes? Y si hay, ¿De qué color son?","Todos deben poder verlo, nada lo debe opacar o minimizar."
esp,10,7,¿A qué hora del día está el sol?,"Ahora y cada día es tiempo para que tengas éxito, nunca es demasiado temprano ni demasiado tarde."
esp,10,8,¿Está iluminando algo?,Debe ser benéfico.
esp,10,9,"Si ilumina algo, ¿Qué ilumina?",Debe beneficiar a todos y a todo.
esp,10,10,Incluir la tarea.,Incluir la tarea.